user_input,retrieved_contexts,response,reference,answer_relevancy,faithfulness,context_precision,context_recall
Meddig tárolják a biztosítási szerződésekhez kapcsolódó adatokat?,"['tosítási szerződést érintő események, káresemények adatai (lásd 3.1.8. pontban foglalt adatok).\n\nAdatkezelés időtartama: A Biztosító a személyes adatokat a biztosítási jogviszonyra irányadó szabályok (lásd 3.1.3 pont) szerint \nkezeli.\n\n7', 'si szerződéssel, létrejöttével, nyilvántartásával, a szolgáltatással összefüggő összes lényeges tény és körülmény\n\nAdatkezelés időtartama: A biztosítási szerződéshez kapcsolódó személyes adatait a Biztosító a biztosítási szerződés megszűné-\nsét követő naptári év első napjától számított 8 évig őrzi meg, a biztosítási szerződéssel kapcsolatos esetleges későbbi igények ér-\nvényesítése, valamint a Biz', 'által kötelezően előírt adatmegőrzési határidőket, valamint a Biztosítóval szemben támasztott \nesetleges követelések jogszabályi vagy szerződésben meghatározott elévülési idejét. A Biztosító a személyes adatok tárolásá-\nnak időtartamáról adatkezelési célonként nyújt tájékoztatást.\n\n2', 'tosító leendő ügyfelei, ügyfelei\n\nKezelt adatok köre: Az ügyfél igényének felméréséhez, pontosításához szükséges információk, megfelelési és alkalmassági teszt-\nhez szükséges adatok\n\nAdatkezelés időtartama: A Biztosító az igényfelmérés alapján létrejött biztosítási szerződés esetén a személyes adatokat a létrejött \nbiztosítási jogviszonyra irányadó szabályok (lásd 3.1.3 pont) szerint kezeli. \n\n3', 'szám, hívás kezdeményezés helye, szerződés kötvényszáma, \nhívás pontos ideje.\n\nAdatkezelés időtartama: A Biztosító a panaszt, az arra adott választ és a rögzített hangfelvételt a Bit. 159. § (3) bekezdése alapján \n5 évig őrzi meg.\n\n3.2.9. Hatósági megkeresésekkel, eljárásokkal kapcsolatos feladatok ellátása\n\nAdatkezelés célja: A biztosítási jogviszonyt érintő hatósági megkeresések megválaszolása é']",A biztosítási szerződésekhez kapcsolódó személyes adatokat a Biztosító a biztosítási szerződés megszűnését követő naptári év első napjától számított 8 évig őrzi meg.,8 év szerződés megszűnését követő naptári év,0.8698255887235091,1.0,0.999999999975,1.0
Mi az a kötelező gépjármű-felelősségbiztosítás?,"['Gépjármű-biztosítás', 'nység végzé-\nsére, és Magyarország területén az e tör\xadvényben foglaltaknak \nmegfelelően a kötelező gép\xadjármű-felelősség\xadbiztosítási (a to-\nvábbiakban: bizto\xadsítás) tevékenység folytatására jogosult;\n4. biztosított: a gépjármű biztosítással rendelkező üzem\xad\nben tartója és a gépjárművet vezető személy;\n5. díjtarifa: miniszteri rendeletben meghatározott gépjár\xad\nmű-kategóriánként és – a flotta kivétel', 'MILYEN TÍPUSÚ BIZTOSÍTÁSRÓL VAN SZÓ?\nA KGFB egy felelősség típusú biztosítás, amely a károsultvédelem szem előtt tartásával, a jármű üzemeltetése során a biztosított felelősségi körébe \ntartozó károkozás esetén megtéríti a biztosított helyett az okozott kárt a károsult felé. Ezt a típusú biztosítást minden magyarországi telephelyű \ngépjármű üzembentartójának kötelező megkötnie és hatályban tartania.', 'Az üzemben tartó köteles 8 napon belül bejelenteni \na biztosítónak a biztosítást igazoló okiratban feltüntetett \nadatok változását.\n\n12. §\nA biztosítás kiterjed a felelősség kérdésének vizsgálatára, és \nazoknak a megalapozott kártérítési igényeknek a kielégítésé-\nre, amelyeket a biztosított személyekkel szemben a biztosítási \nszerződésben megjelölt gépjármű üzemeltetése során oko-\nzott károk miatt', 'KÖTELEZŐ GÉPJÁRMŰ-FELELŐSSÉGBIZTOSÍTÁSI FELTÉTEL \nÉS ÜGYFÉLTÁJÉKOZTATÓ\n\nJelen biztosítási feltételt 2024.07.16-tól kell alkalmazni. A biz-\ntosítási feltétel a kötelező gépjármű-felelősségbiztosításról \nszóló 2009. évi LXII. törvény (továbbiakban Gfbt) és a kap-\ncsolódó jogszabályok szó szerinti ismertetése a szerződő \nfelek jogait és kötelezettségeit nem érintő rendelkezések ki-\nvételével. A hivat']","A kötelező gépjármű-felelősségbiztosítás egy olyan biztosítás, amely a jármű üzemeltetése során a biztosított felelősségi körébe tartozó károkozás esetén megtéríti az okozott kárt a károsult felé. Minden magyarországi telephelyű gépjármű üzembentartójának kötelező megkötnie és hatályban tartania.",jármű üzemeltetése kár fedezete,0.9740041175817765,1.0,0.3333333333,1.0
Milyen esetekre nem terjed ki a biztosítás?,"['Milyen korlátozások vannak a biztosítási \nfedezetben?\nA biztosítás alapján a biztosító visszkeresettel élhet többek \nközött az alábbi esetekben:', 'Mire terjed ki a biztosítás?\n✓ A biztosítás a jármű üzemeltetése során okozott dologi Mire nem terjed ki a biztosítás?\nFőbb kizárások (a felsorolás nem teljes körű):', 'Mikor és hogyan kell fizetnem?\nA biztosítási díj a biztosítót a kockázatviselés tartamára előre illeti meg. A biztosítási díj fizetésének módját és gyakoriságát a \nszerződés tartalmazza, a szerződő és a biztosító megállapodása szerint. A díjfizetés történhet egy, kettő, négy, avagy tizenkét \nrészletben a termékre vonatkozó teljes körű tájékoztatókban foglaltak figyelembevételével postai csekken, banki és egyéb \nszolgáltatókon keresztül történő átutalással, csoportos beszedéssel, avagy bankkártyás teljesítéssel. A biztosítási díjnak \nesedékességétől számított 60. napig a biztosítóhoz be kell érkeznie, különben a szerződés megszűnik.', 'adása esetén részére nem nyújtható előny. \n3. A biztosítási titok tekintetében, időbeli korlátozás nél\xad\nkül – ha a Bit. másként nem rendelkezik – titoktartási \nkötelezettség terheli a biztosító vagy viszontbiztosító tu\xad\nlajdonosait, vezetőit, alkalmazottait és mindazokat, akik \nahhoz a biztosítóval kapcsolatos tevékenységük során \nbármilyen módon hozzájutottak. \n4. Az ügyfél egészségi állapotával', 'és esetén a biztosítási időszak vagy a tartam utolsó napját \nkövető – az új biztosítási időszak vagy a határozott tartam \nkezdő napját, biztosítóváltás esetén az előző biztosítási \nidőszakra vonatkozóan a fedezetet nyújtó biztosító meg\xad\nnevezését és a biztosítást igazoló okirat számát, továbbá \n\n6']",A biztosítás nem terjed ki az ügyfél egészségi állapotával kapcsolatos esetekre.,háborús cselekmény karbantartás verseny,0.9374857038458241,0.0,0.0,0.3333333333333333
Milyen dokumentumokat kérhet be a biztosító egy kárigényhez?,"[', aláírási címpéldány,\n8.\tÍrásban tett nyilatkozat (fax, e-mail, levél) az igénylő, vagy jogosult által megjelölt megjelölt bankszámlaszámról, vagy postai \nkézbesítési címről a kifizetéshez, mely nyilatkozat tartalmazza hivatkozási adatként a biztosító kárszámát, vagy a károsult \nrendszámát és a kárdátumot,\n19.\tÍrásbeli kamatigénylés,\n10.\tA biztosító megbízottjai, alkalmazottjai által kért részlet', 'a biztosító rendelkezésére állnak, az igazolást a kárnyilvántar-\ntó szerv megkeresése nélkül a biztosító is kiadhatja.\n\n15', 'es nyilatkozat a káresemény körülményeinek tisztázásához,\n11.\t Meghatalmazás a biztosító részére, hogy a rendőrségi, ügyészségi, bírósági iratokba betekinthet, azokról másolatokat készíthet,\n12.\t Károsult nyilatkozata a társbiztosítói előzmények adatkéréséhez,\n13.\tEgyedi, speciális kárigény esetén a kárigény jogosságát és mértékét igazoló irat.\n\nB.\t\nTovábbi iratok a gépjárműben történt károsodásná', 'Jelen biztosítási szerződés alapján keletkezett kártérítési igények a Polgári Törvénykönyv elévülési szabályai sze-\nrint évülnek el.\n\nA KGFB kárbejelentéseknél kért iratok, okiratok:\n\nA.\t\nÁltalánosan kért iratok\n\n1.\t A biztosító által rendszeresített, vagy azzal megegyező tartalmú, kitöltött és aláírt kárbejelentő nyomtatvány,\n2.\tRészletes, okozói nyilatkozat,\n3.\tA kárbejelentésben jelzett káresem', 'kárfelvételi jegyzőkönyv,\n6.\tKeletkezett károk biztosító megbízottja által készített fotódokumentációja,\n7.\t A 2009. évi LXII. Tv. (Gfbt. Törvény) szerint az arra jogosult nyilatkozata a helyreállítás szándékáról,\n8.\tRészletes javítási árajánlat, mely tartalmazza a költségeket, időtartamot és a javítás lehetséges megkezdésének időpontját,\n9.\tÁFA-visszatérítésre vonatkozó nyilatkozat (káreseménnye']","A biztosító által kért dokumentumok egy kárigény esetén lehetnek: 
- A biztosító által rendszeresített, vagy azzal megegyező tartalmú, kitöltött és aláírt kárbejelentő nyomtatvány,
- Részletes, okozói nyilatkozat,
- A kárbejelentésben jelzett káresemény kárfelvételi jegyzőkönyv,
- Keletkezett károk biztosító megbízottja által készített fotódokumentációja,
- A 2009. évi LXII. Tv. (Gfbt. Törvény) szerint az arra jogosult nyilatkozata a helyreállítás szándékáról,
- Részletes javítási árajánlat, mely tartalmazza a költségeket, időtartamot és a javítás lehetséges megkezdésének időpontját,
- ÁFA-visszatérítésre vonatkozó nyilatkozat.",jegyzőkönyv orvosi dokumentum bankszámlaszám,0.8379401645884758,,0.0,0.6666666666666666
Hogyan zajlik az adatkezelés a biztosítónál?,"['ciókról, így különösen, az \nadatkezelés céljáról, a kezelt személyes adatokról, a címzettekről, akiknek az Ön adatait továbbítottuk, a személyes adatok \ntárolásának tervezett időtartamáról, valamint az automatizált döntéshozatallal kapcsolatos tudnivalókról.\n\nA Biztosítónak a tájékoztatást és intézkedést díjmentesen kell biztosítani. Ha a kérelem egyértelműen megalapozatlan vagy – \nkülönösen ismét', 'z ágazati jogszabályokban foglalt előírások szerint gondoskodik.\n\nA Biztosító gondoskodik arról, hogy a kezelt adatokhoz illetéktelen személy ne férhessen hozzá, ne hozhassa nyilvánosságra, \nne továbbíthassa, valamint azokat ne módosíthassa, törölhesse.\n\nA Biztosító megtesz minden tőle telhetőt annak érdekében, hogy az adatok ne sérüljenek, illetve ne semmisüljenek meg. A fenti \nkötelezettségválla', 'által kötelezően előírt adatmegőrzési határidőket, valamint a Biztosítóval szemben támasztott \nesetleges követelések jogszabályi vagy szerződésben meghatározott elévülési idejét. A Biztosító a személyes adatok tárolásá-\nnak időtartamáról adatkezelési célonként nyújt tájékoztatást.\n\n2', 'emélyes adatok kezelését előíró, a Biztosítóra alkalmazan-\ndó uniós vagy tagállami jog szerinti kötelezettség teljesítése céljából, vagy jogi igények előterjesztéséhez, érvényesítéséhez, \nilletve védelméhez.\n\nHa a Biztosító nyilvánosságra hozta a törlendő személyes adatot, az elérhető technológia és a megvalósítás költségeinek \nfigyelembevételével, megteszi az ésszerűen elvárható lépéseket annak é', 'etnyújtás könnyebb ellenőrzése.\n\nÉrintettek köre: Biztosító ügyfelei\n\nKezelt adatok köre:\n•\t Lakásbiztosítások, hitelbiztosítéki záradék, záradékolási kérelem, díjhátralékos biztosítások adatai\n\nAdatkezelés időtartama: A Biztosító a személyes adatokat a biztosítási jogviszonyra irányadó szabályok (lásd 3.1.3 pont) szerint, \nilletve a DLT rendszerben a biztosítási szerződés megszűnését követő 30 na']","Az adatkezelés a biztosítónál a személyes adatok védelmére és biztonságára összpontosít. A biztosító gondoskodik arról, hogy az adatokhoz illetéktelen személy ne férhessen hozzá, ne hozhassa nyilvánosságra, ne továbbíthassa, valamint azokat ne módosíthassa, törölhesse. Az adatokat a biztosítási jogviszonyra irányadó szabályok szerint kezelik, valamint a biztosítási szerződés megszűnését követő 30 napig tárolják a DLT rendszerben. A biztosító minden tőle telhetőt megtesz az adatok sérülésének vagy megsemmisülésének megakadályozása érdekében.",GDPR célhoz kötött meghatározott ideig,0.8289661409397849,1.0,0.19999999998,1.0
"Mi történik, ha az ügyfél nem járul hozzá az adatkezeléshez?","['s, és Ön ellenzi az adatok törlését, és e helyett kéri azok felhasználásának korlátozását;\n\nc)\ta Biztosítónak már nincs szüksége a személyes adatokra adatkezelés céljából, de Ön igényli azokat jogi igények előter-\njesztéséhez, érvényesítéséhez vagy védelméhez; vagy\n\nd)\tÖn tiltakozott az adatkezelés ellen.\n\nHa a helyesbítés, korlátozás vagy törlés iránti kérelme nem teljesíthető, akkor a kérelem ké', 'ellen tiltakoznia.\n\nA személyes adatok a továbbiakban e célból nem kezelhetők, kivéve, ha a Biztosító bizonyítja, hogy az adatkezelést olyan \nkényszerítő erejű jogos okok indokolják, amelyek elsőbbséget élveznek az Ön érdekeivel, jogaival és szabadságaival szemben, \nvagy amelyek jogi igények előterjesztéséhez, érvényesítéséhez vagy védelméhez kapcsolódnak.\n\n8.6. ADATHORDOZHATÓSÁGHOZ VALÓ JOG\nÖn j', 'sítését a Biztosító korlátozza vagy ezen jogainak érvényesítésére irányuló kérelmét elutasítja, vagy Ön \nbármikor úgy ítéli meg, hogy személyes adatai kezelésével kapcsolatban jogsérelem következett be, vagy annak közvetlen \nveszélye fennáll.\n\n16', 'gy amennyiben a személyes adatok kezelése nélkülözhetetlen a szerző-\ndés alapján nyújtott szolgáltatások megítéléséhez, a hozzájárulás visszavonása a szolgáltatás nyújtásának \nellehetetlenülését vonhatja maga után.\n\n8.8. HATÓSÁGI JOGORVOSLATHOZ VALÓ JOG\nÖn jogosult arra, hogy a felügyeleti hatóság vizsgálatát kezdeményezze, ha megítélése szerint a személyes adataival kapcso-\nlatos jogainak érvénye', 'juk kapcsolódó személyes adatait kezelje és nyilvántartsa.\nFelhívjuk a figyelmét, hogy mivel az egészségügyi adatok kezelése nélkülözhetetlen a biztosítási szerződésből származó követelések, \nígy különösen a szolgáltatási kötelezettség beálltának, jogalapjának és összegszerűségének megítéléséhez, ezért a hozzájárulás \nvisszavonása a szolgáltatás nyújtásának ellehetetlenülését vonhatja maga után.']","Ha az ügyfél nem járul hozzá az adatkezeléshez, akkor a személyes adatokat nem lehet kezelni a megadott célból, kivéve, ha a Biztosító bizonyítja, hogy az adatkezelést olyan kényszerítő erejű jogos okok indokolják, amelyek elsőbbséget élveznek az ügyfél érdekeivel, jogival és szabadságával szemben, vagy amelyek jogi igények előterjesztéséhez, érvényesítéséhez vagy védelméhez kapcsolódnak.",visszautasítás szolgáltatás ellehetetlenülése,0.8419175358885748,0.75,0.32499999998375,1.0
Mikor kezdődik a biztosítási fedezet?,"['Mikortól meddig tart a kockázatviselés?\nA biztosítási fedezet a szerződésben meghatározott időpontban kezdődik.\nA biztosítási fedezet megszűnik különösen: \n–\t a jármű eladása, avagy az üzembentartói jog megszűnésének napján,\n–\t évfordulóra történő felmondás esetén az évforduló napján,\n–\t határozott tartamú szerződés esetén a lejárat napján,\n–\t díjnemfizetés esetén a türelmi idő leteltével.', 'Mikor és hogyan kell fizetnem?\nA biztosítási díj a biztosítót a kockázatviselés tartamára előre illeti meg. A biztosítási díj fizetésének módját és gyakoriságát a \nszerződés tartalmazza, a szerződő és a biztosító megállapodása szerint. A díjfizetés történhet egy, kettő, négy, avagy tizenkét \nrészletben a termékre vonatkozó teljes körű tájékoztatókban foglaltak figyelembevételével postai csekken, banki és egyéb \nszolgáltatókon keresztül történő átutalással, csoportos beszedéssel, avagy bankkártyás teljesítéssel. A biztosítási díjnak \nesedékességétől számított 60. napig a biztosítóhoz be kell érkeznie, különben a szerződés megszűnik.', 'Milyen korlátozások vannak a biztosítási \nfedezetben?\nA biztosítás alapján a biztosító visszkeresettel élhet többek \nközött az alábbi esetekben:', 'károk fedezetére \naz e törvényben meghatározott feltételek szerinti biztosí-\ntási szerződést kötni, és azt díjfizetéssel hatályban tarta-\nni (biztosítási kötelezettség).\n(2) A biztosítási kötelezettség – ha jogszabály másként \nnem rendelkezik – a mindenkori üzemben tartót a gépjár-\nműhasználat kezdetétől a gépjárműhasználat végleges \nmegszűnéséig terheli.\n(3) A szerződés megkötésére vonatkozó köte', 'sítási díjrészlettel együtt, a biztosítási időszakra járó teljes díj \negyösszegű megfizetése esetén 30 napos határidővel köteles \nmegfizetni. A biztosító, ha a fedezetlenséggel érintett időszak \nmeghaladja a 120 napot, részletfizetési lehetőséget nyújthat.\n(6) Ha az üzemben tartó az (5) bekezdésben meghatáro\xad\nzott kötelezettségének nem tesz eleget, a 21. § (4) bekez\xad\ndésében meghatározott rendelke']",A biztosítási fedezet a szerződésben meghatározott időpontban kezdődik.,szerződésben meghatározott időpont,0.9746469620845376,1.0,0.9166666666361111,1.0
Milyen jogai vannak az ügyfélnek az adatkezeléssel kapcsolatban?,"['ármű-felelősségbiztosítási kötvény adatairól, valamint jogos érdekének érvényesítése céljából \nadatigénylésre jogosult nyilvántartásból a jogszabályban meghatározott adatok tekintetében a biztosítási szerződés megkötése, \nállományban tartása, módosítása, a biztosítási szerződést érintő biztosítási események, káresemények, kárügyintézés érdekében.\n\nAdatkezelés jogalapja: A GDPR 6. cikk (1) bekezdés', 'ly által kötelezően elvárt kártérítési javaslat megtétele vagy \nindoklással ellátott válasz megadása érdekében szükséges, az adatkezelés jogalapja a GDPR 9. cikk (2) bekezdés f) pontja, mely \nszerint az adatkezelés az adatkezelő kárügyintézéshez, szolgáltatási igény elbírásával összefüggő jogi igény érvényesítéséhez, illetve \nvédelméhez fűződő jogos érdeke.\n\nÉrintettek köre: Biztosító ügyfelei\n\nKe', 's az eljárásokkal lefolytatásának elő-\nsegítése\n\nAdatkezelés jogalapja: A GDPR 6. cikk (1) bekezdés c) pontja alapján, mely szerint az adatkezelés a Biztosítóra vonatkozó jogi \nkötelezettség teljesítéséhez szükséges. Az adatkezelés törvényi jogalapja a Ptk, Bit. és a vonatkozó jogszabályok rendelkezései.\n\nÉrintettek köre: Biztosító ügyfelei, hatósági megkereséssel érintett természetes személyek\n\nK', 'határozott jogi kötelezettség teljesítéséhez szükséges adatok\n\nAdatkezelés időtartama: A Biztosító a személyes adatokat a biztosítási jogviszonyra irányadó szabályok (lásd 3.1.3 pont) szerint \nkezeli.\n\n3.2.7. Számviteli bizonylatok megőrzésére vonatkozó kötelezettség teljesítése\n\nAdatkezelés célja: Számviteli bizonylatok megőrzésére vonatkozó kötelezettség teljesítése.\n\nAdatkezelés jogalapja: A GD', 'ogosult arra, hogy az Önre vonatkozó, a Biztosító rendelkezésére bocsátott személyes adatokat tagolt, széles körben \nhasznált, géppel olvasható – ha ez technikailag megvalósítható – formátumban megkapja, ha az adatkezelés hozzájáruláson, \nvagy szerződésen alapul és az adatkezelés automatizált módon történik. A jelen pont szerinti adathordozhatósághoz való jog \nnem teremt kötelezettséget arra vonat']","Az ügyfél jogosult arra, hogy az Önre vonatkozó, a Biztosító rendelkezésére bocsátott személyes adatokat tagolt, széles körben használt, géppel olvasható formátumban megkapja, ha az adatkezelés hozzájáruláson, vagy szerződésen alapul és az adatkezelés automatizált módon történik. A jelen pont szerinti adathordozhatósághoz való jog nem teremt kötelezettséget arra vonat.",hozzáférés törlés adathordozhatóság,0.0,0.8,0.19999999998,1.0
Kik férhetnek hozzá a biztosítási titoknak minősülő adatokhoz?,"['séhez szükséges célokra \nhasználhatóak a Biztosítótól kapott adatok. A kiszervezett tevékenységet végzők az adat- és titokvédelemre vonatkozó jog-\nszabályokat kötelesek betartani. A biztosítási titok megőrzésére vonatkozó kötelezettséget, felelősséget és a titok megtartása \nérdekében teendő intézkedéseket a velük kötött szerződés is biztosítja.\n\nAmennyiben a szerződésben foglalt szolgáltatás telje', 'an az alábbi adatokat kérheti: \na.\t a szerződő, a biztosított, a kedvezményezett személy \nazonosító adatait; \nb.\t a biztosított személy adatfelvételkori, a szerződéses \nkockázattal kapcsolatos egészségi állapotára vonat\xad\nkozó adatokat; \nc.\t az a. pontban meghatározott személyt érintő koráb\xad\nbi – a 3. pontban meghatározott ágazathoz tartozó \nszerződéssel kapcsolatos – biztosítási eseményekre \nvonat', 'zzájutottak.\n\nA biztosítási titoknak minősülő adatokat jogosultak megismerni mindazon személyek vagy szervezetek is, akikkel szemben a \nBiztosítónak a biztosítási titok megtartásának a kötelezettsége a Bit. 138-143. § és a 147-151. § értelmében nem áll fenn. A té-\nteles felsorolás a Bit. „Az ügyfelek tájékoztatásáról” szóló 4. számú melléklete szerint a biztosítási tájékoztató kötelező tartalmi \ne', 'összefüggő az egész\xad\nségügyi és a hozzájuk kapcsolódó személyes adatok \nkezeléséről és védelméről szóló törvényben (a további\xad\nakban: Eüak.) meghatározott egészségügyi adatokat a \nbiztosító az 1. pontban meghatározott célokból, az Eüak. \nrendelkezései szerint, kizárólag az érintett kifejezett hoz\xad\nzájárulásával kezelheti. \n5. Biztosítási titok csak akkor adható ki harmadik sze\xad\nmélynek, ha \na.\t a', 'lásának hiányában – az \nadattovábbítás a személyes adatok harmadik országba \nvaló továbbítására vonatkozó előírásoknak megfelel.\n16. A biztosítási titoknak minősülő adatoknak másik tagál\xad\nlamba történő továbbítása esetén a belföldre történő adat\xad\ntovábbításra vonatkozó rendelkezéseket kell alkalmazni. \n17. Nem jelenti a biztosítási titok sérelmét \na.\t az olyan összesített adatok szolgáltatása, ame']","Azok a személyek vagy szervezetek férhetnek hozzá a biztosítási titoknak minősülő adatokhoz, akikkel szemben a Biztosítónak a biztosítási titok megtartásának a kötelezettsége nem áll fenn a vonatkozó jogszabályok alapján.",biztosító hatóság érintett engedélye,0.9999999999999987,1.0,0.8041666666465626,0.0
Milyen célból kér a biztosító egészségügyi adatokat?,"['3.1.4. Egészségügyi adatok kezelése a biztosítási szerződés megkötése, állományban tartása során\n\nAdatkezelés célja: A Biztosítási szerződés megkötésével, módosításával, állományban tartásával, valamint a biztosítási szerző-\ndésből származó díjak, követelések megítélésével összefüggésben az egészségi állapotra vonatkozó különleges személyes adatok \nkezelése. Az adatkezelés célja különösen a kockáz', 'összefüggő az egész\xad\nségügyi és a hozzájuk kapcsolódó személyes adatok \nkezeléséről és védelméről szóló törvényben (a további\xad\nakban: Eüak.) meghatározott egészségügyi adatokat a \nbiztosító az 1. pontban meghatározott célokból, az Eüak. \nrendelkezései szerint, kizárólag az érintett kifejezett hoz\xad\nzájárulásával kezelheti. \n5. Biztosítási titok csak akkor adható ki harmadik sze\xad\nmélynek, ha \na.\t a', 'sítése érdekében elengedhetetlen, a Biztosító harmadik országba továb-\nbítja az Ön személyes adatait annak érdekében, hogy Ön harmadik országban részesülhessen egészségügyi ellátásban, vagy \nott vehessen igénybe szolgáltatásokat.\n\n5. ADATBIZTONSÁGI INTÉZKEDÉSEK\nA Biztosító gondoskodik az adatok biztonságáról és megteszi mindazokat a technikai és szervezési intézkedéseket, amelyek \na vonatkozó jogs', 'felelősségbiztosítási szerződés esetén az egészségi állapottal összefüggő adatok (lásd 3.1.4. pontban foglalt adatok)\n•\t A biztosított, károsult vagyontárgy adatai (lásd 3.1.8. pontban foglalt adatok)\n•\t Biztosítási igény felméréséhez kapcsolódó adatok: Az ügyfél ismereteinek, tapasztalatainak felméréséhez, értékeléséhez szüksé-\nges adatok, amelyeket az ügyfél a Biztosító ezen célra rendszeresíte', '.\n\nAdatkezelés időtartama: A Biztosító az egészségügyi adatokat a biztosítási jogviszonyra irányadó szabályok (lásd 3.1.3 pont) sze-\nrint, illetve az adatkezeléshez adott hozzájárulás – a Tájékoztatóban említett feltételekkel történő – visszavonásáig kezeli.\n\nAz adatkezelési cél eléréséhez nélkülözhetetlen, hogy Ön felhatalmazza a Biztosítót, hogy az egészségi állapotára vonatkozó és \nhozzájuk kap']","A biztosító az egészségügyi adatokat a biztosítási szerződés megkötésével, módosításával, állományban tartásával, valamint a biztosítási szerződésből származó díjak, követelések megítélésével összefüggésben kezeli.",kockázat-elbírálás kárigény elbírálása,0.869620906262928,1.0,0.8874999999778125,1.0
Mire vonatkozik a biztosítási titok fogalma?,"['Mire terjed ki a biztosítás?\n✓ A biztosítás a jármű üzemeltetése során okozott dologi Mire nem terjed ki a biztosítás?\nFőbb kizárások (a felsorolás nem teljes körű):', 'séhez szükséges célokra \nhasználhatóak a Biztosítótól kapott adatok. A kiszervezett tevékenységet végzők az adat- és titokvédelemre vonatkozó jog-\nszabályokat kötelesek betartani. A biztosítási titok megőrzésére vonatkozó kötelezettséget, felelősséget és a titok megtartása \nérdekében teendő intézkedéseket a velük kötött szerződés is biztosítja.\n\nAmennyiben a szerződésben foglalt szolgáltatás telje', 'vezető, valamint a biztosító és a viszontbiztosító alkalma\xad\nzottja, megbízottja köteles a biztosító és a viszontbizto\xad\nsító működésével kapcsolatban tudomására jutott üzleti \ntitkot – időbeli korlátozás nélkül – megőrizni.\n1. Az V. pontban előírt titoktartási kötelezettség nem áll \nfenn a feladatkörében eljáró\na) \tFelügyelettel,\nb) \tnemzetbiztonsági szolgálattal,\nc) \tÁllami Számvevőszékkel,\nd) \tGa', 'adása esetén részére nem nyújtható előny. \n3. A biztosítási titok tekintetében, időbeli korlátozás nél\xad\nkül – ha a Bit. másként nem rendelkezik – titoktartási \nkötelezettség terheli a biztosító vagy viszontbiztosító tu\xad\nlajdonosait, vezetőit, alkalmazottait és mindazokat, akik \nahhoz a biztosítóval kapcsolatos tevékenységük során \nbármilyen módon hozzájutottak. \n4. Az ügyfél egészségi állapotával', 'kozott jogszabályok teljes szövege elérhető  \na www.magyarorszag.hu internet oldalon.\nA jelen feltételre vonatkozó hivatkozások és a biztosítási tevé-\nkenységről szóló 2014. évi LXXXVIII. törvény (Bit.) alapján ügy-\nféltájékoztatónak is minősülnek. Az ügyféltájékoztatónak is \nminősülő részek vastag dőlt betűkkel szedettek. A Bizto\xad\nsító mentesülésé\xadnek szabályai, a biztosító szolgáltatása \nkorláto']","A biztosítási titok fogalma arra vonatkozik, hogy a biztosítóval vagy viszontbiztosítóval kapcsolatban dolgozó tulajdonosokra, vezetőkre, alkalmazottakra és azokra, akik bármilyen módon hozzáfértek a biztosító tevékenységéhez, időbeli korlátozás nélkül titoktartási kötelezettség terheli.",személyi vagyoni helyzet biztosítási szerződés,0.8521832739366181,0.8333333333333334,0.0,0.0
Mi történik az adatokkal a szerződés megszűnése után?,"['mélyes adatokat \nkezelhet, ameddig a szerződés létrejöttének meghiúsu\xad\nlásával kapcsolatban igény érvényesíthető.\n23. A biztosító és a viszontbiztosító köteles törölni min\xad\nden olyan, ügyfeleivel, volt ügyfeleivel vagy létre nem jött \nszerződéssel kapcsolatos személyes adatot, amelynek \nkezelése esetében az adatkezelési cél megszűnt, vagy \namelynek kezeléséhez az érintett hozzájárulása nem áll \nre', 'Hogyan szüntethetem meg a szerződést?\nÉvfordulóra indoklás nélkül – költségmentesen – felmondható legalább 30 nappal az évfordulót megelőzően. A szerződés \nmegszűnhet érdekmúlás (ide értve pl.: a forgalomból való végleges kivonást) és közös megegyezés esetén is.', 'tosítóra a jogszabályokban előírt adatmegőrzési kötelezettségekre tekintettel. A határidő lejártát követően \nszemélyes adatai törlésre kerülnek. A személyes adatok törlését gátolja, amennyiben:\n–\t peres eljárás van folyamatban az adott szerződés tekintetében,\n–\t peren kívül hatósági eljárás van folyamatban az adott szerződés tekintetében,\n–\t panasz kezelése van folyamatban az adott szerződés tekin', 'a megszűnt szerződés külön rendeletben \nmeghatározott bonus-malus besorolásáról a megszűnést, il-\nletve az arról történt tudomásszerzést követő 30 napon belül \naz üzemben tartót írásban tájékoztatni.\n(4) A szerződésre a magyar jogot kell alkalmazni.\n(5) A szerződésre a Polgári Törvénykönyv rendelkezései akkor \nalkalmazhatók, ha e törvény eltérő rendelkezést nem tartalmaz.\n\n7. §\n(1) A biztosítási', 'hozzáférhetővé tenni.\n\n(4) A szerződés érdekmúlással szűnik meg a tulajdonjog át-\nszállása esetén, ha a szerződéskötésre kötelezett üzemben \ntartó személyében változás áll be.\n(5) Ha az üzemben tartó változása a jogi személy jogutódlással \ntörténő megszűnése, vagy – az egyéni vállalkozóról és az egyéni \ncégről szóló 2009. évi CXV. törvény alapján – az egyéni vállal-\nkozói tevékenység folytatására']","Az adatok törlésre kerülnek a szerződés megszűnése után, amennyiben nincs peres vagy hatósági eljárás folyamatban, valamint nincs panaszkezelés az adott szerződés tekintetében. A határidő lejártát követően a személyes adatokat törlik a biztosítótól a jogszabályokban előírt adatmegőrzési kötelezettségek figyelembevételével.",8 év jogi eljárás,0.8627739034832563,0.8,0.0,0.0
Milyen esetekben kérhet a biztosító kiegészítő adatokat?,"['ésre, a Biztosító kiegészítő nyilatkozat \nútján elvégzi a helyesbítést és kiegészítést.\n\nAz adatpontosság fenntartása érdekében Ön vállalja, hogy az adataiban bekövetkezett változást 5 munkanapon belül bejelen-\nBiztosító Zrt. 1519 Budapest, Pf. 260., vagy személyesen a Biztosító központi ügyfélszolgálati irodájában. A Biztosító jogosult \nindokolt esetben Önt felhívni arra, hogy a pontosított adato', 'üzleti titkot ne tar-\ntalmazzanak és a biztosítók beazonosítása ne váljon lehetővé.\n(6) A (4) bekezdés szerinti biztosító által igényelhető adatok \nköre a következőkre terjed ki:\na)\t a szerződésekre (szerződőre, járműre) vonatkozó nem \npénzösszeg típusú jellemzők,\nb)\t a részkárokra vonatkozó nem pénzösszeg típusú jellemzők,\nc)\t a kárkifizetésekre és kártartalékokra vonatkozó adatok,\nd)\t a változó', 'kozó adatokat; \nd.\t a megkeresett biztosítónál megkötött szerződés \nmegkötésével kapcsolatban felmerült kockázat fel\xad\nméréséhez szükséges adatokat; és \ne.\t a megkeresett biztosítónál megkötött szerződés alap\xad\nján teljesítendő szolgáltatások jogalapjának vizsgála\xad\ntához szükséges adatokat. \n4. A megkereső biztosító a Bit. 1. melléklet A) rész 3-9. \nés 14-18. pontjában meghatározott ágazatokhoz tart', 'an az alábbi adatokat kérheti: \na.\t a szerződő, a biztosított, a kedvezményezett személy \nazonosító adatait; \nb.\t a biztosított személy adatfelvételkori, a szerződéses \nkockázattal kapcsolatos egészségi állapotára vonat\xad\nkozó adatokat; \nc.\t az a. pontban meghatározott személyt érintő koráb\xad\nbi – a 3. pontban meghatározott ágazathoz tartozó \nszerződéssel kapcsolatos – biztosítási eseményekre \nvonat', 'e vonatkozó adatokat; \nd.\t a megkeresett biztosítónál megkötött szerződés \nmegkötésével kapcsolatban felmerült kockázat fel\xad\nméréséhez szükséges adatokat; és \ne.\t a megkeresett biztosítónál megkötött szerződés alap\xad\nján teljesítendő szolgáltatások jogalapjának vizsgála\xad\ntához szükséges adatokat. \n5. A megkereső biztosító a Bit. 1. melléklet A) rész 10-13. \npontjában meghatározott ágazatokhoz tarto']","A biztosító kiegészítő adatokat kérhet a szerződésekre (szerződőre, járműre) vonatkozó nem pénzösszeg típusú jellemzők esetében, a részkárokra vonatkozó nem pénzösszeg típusú jellemzők esetében, a kárkifizetésekre és kártartalékokra vonatkozó adatok esetében, valamint a változó adatok esetében.",egészségkárosodás vitás ügy,0.9462948031828523,0.8,0.0,0.0
"Mi a teendő, ha az ügyfél vitatja a biztosító döntését?","['iszontbiztosí\xad\ntó, továbbá az ügyfél felhatalmazása nélkül nem adható \nki harmadik személynek és feladatkörön kívül nem hasz\xad\nnálható fel.\n9. Aki üzleti titok birtokába jut, nem használhatja fel arra, \nhogy annak révén saját maga vagy más személy részére \nközvetlen vagy közvetett módon előnyt szerezzen, továb\xad\nbá, hogy a biztosítónak, a viszontbiztosítónak vagy ügy\xad\nfeleinek hátrányt okozzon.\n\nA b', 'ó adta meg, illetve engedélyezte. Ennek valódiságát a Biztosító jogosult ellenőrizni és \nmegalapozatlanság esetén további nyilatkozatokat kérhet be. \n\n13', 'adása esetén részére nem nyújtható előny. \n3. A biztosítási titok tekintetében, időbeli korlátozás nél\xad\nkül – ha a Bit. másként nem rendelkezik – titoktartási \nkötelezettség terheli a biztosító vagy viszontbiztosító tu\xad\nlajdonosait, vezetőit, alkalmazottait és mindazokat, akik \nahhoz a biztosítóval kapcsolatos tevékenységük során \nbármilyen módon hozzájutottak. \n4. Az ügyfél egészségi állapotával', 'an egyértelműen fel \nkell hívni az ügyfél figyelmét arra, hogy a személyes ada\xad\ntai e §-ban foglalt kezelésének lehetőségét bármikor kor\xad\nlátozhatja vagy megtilthatja.\n\nV. A BIZTOSÍTÓ ÉS VISZONTBIZTOSÍTÓ ÜZLETI \nTITKA \nA biztosító, a viszontbiztosító, valamint ezek tulajdono\xad\nsa, a biztosítóban, a viszontbiztosítóban részesedést \nszerezni kívánó személy, a vezető állású személy, egyéb \n\n23', 'iztosító érdeke ezt az ügyféllel szemben fennálló \nkövetelése eladásához vagy követelése érvényesíté\xad\nséhez szükségessé teszi. \n6. A biztosítási titok megtartásának kötelezettsége nem \náll fenn \na.\t a feladatkörében eljáró Felügyelettel, \nb.\t az előkészítő eljárást folytató szervvel, a nyomozó \nhatósággal és az ügyészséggel, valamint a szabály\xad\n\n21']","Az ügyfélnek lehetősége van arra, hogy vitája esetén további nyilatkozatokat tegyen, amelyeket a biztosító jogosult ellenőrizni. A biztosító döntése megalapozatlanság esetén további információk kérésére van lehetőség.",panasz jogorvoslat,0.0,0.6666666666666666,0.0,0.0
